,timeline,news,Emotions,fear_percentage,anger_percentage,sadness_percentage,joy_percentage,surprise_percentage,fear,anger,sadness,joy,surprise
2020-01-01 00:00:00,2020-01-01 00:00:00-2020-01-01 00:00:00,['Virus in air sends kids to ICUs with respiratory infections'],[1],100.0,0.0,0.0,0.0,0.0,1,0,0,0,0
2020-01-19 00:00:00,2020-01-19 00:00:00-2020-01-19 00:00:00,['Coronavirus: Govt steps up screening at state airports'],[1],100.0,0.0,0.0,0.0,0.0,1,0,0,0,0
2020-01-26 00:00:00,2020-01-26 00:00:00-2020-01-26 00:00:00,"['Coronavirus outbreak: Lockdown in Wuhan University worries parents in Chennai', 'Coronavirus: 10-bed facility ready at GH; airlines; airport step up safety measures']","[1, 2]",50.0,0.0,0.0,50.0,0.0,1,0,0,1,0
2020-01-27 00:00:00,2020-01-27 00:00:00-2020-02-02 00:00:00,"['Coronavirus: 1;500 from Hong Kong screened at Chennai airport', 'Coronavirus pushes up demand for N95 face masks from India', 'Coronavirus: No facility at Chennai airport to handle infected flyers', ""Tamil Nadu: 'Avoiding ice creams may not save you from coronavirus; but washing hands will'"", 'Coronavirus outbreak: 2 in isolation; 300 quarantined at home', 'Tamil Nadu puts interstate borders on vigil as precaution against coronavirus']","[1, 0, 1, 2, 1, 1]",66.66666666666666,16.666666666666664,0.0,16.666666666666664,0.0,4,1,0,1,0
2020-02-03 00:00:00,2020-02-03 00:00:00-2020-02-07 00:00:00,"['Coronavirus outbreak: Eight Chinese nationals admitted to isolation ward at Chennai government hospital', ""Don't panic on novel coronavirus: Health minister C Vijaya Baskar"", 'Coronavirus: Special ward at Vellore Government Medical College Hospital', 'Chennai: Eight Chinese flyers test negative for coronavirus', 'Coronavirus outbreak: 7;000 screened at Chennai airport; samples tested so far negative', 'Coronavirus outbreak: Aerobridge assigned for China passengers', ""As 'remedies' for novel coronavirus emerge; officials call for caution"", 'Coronavirus scare: Washing hands is essential; but where is the soap for it?', 'Chennai: Europe; Middle East more favoured as fear of coronavirus makes southeast Asia unpopular', 'Coronavirus outbreak: Plan to speed up security check at Chennai airport hit', ""Coronavirus scare in Tamil Nadu: No clear instructions from government; say doctors' bodies"", 'Tamil Nadu: Private hospitals barred from treating patients with coronavirus symptoms']","[1, 0, 1, 1, 1, 1, 2, 0, 0, 1, 1, 1]",66.66666666666666,25.0,0.0,8.333333333333332,0.0,8,3,0,1,0
2020-02-10 00:00:00,2020-02-10 00:00:00-2020-02-10 00:00:00,['Promises of coronavirus cure give Tamil Nadu headache'],[2],0.0,0.0,0.0,100.0,0.0,0,0,0,1,0
2020-02-18 00:00:00,2020-02-18 00:00:00-2020-02-21 00:00:00,"['No drug shortage in Tamil Nadu due to COVID-19 scare', 'Chennai: 2 Chinese test negative for COVID-19', 'Ship with Chinese crew kept off Chennai port for a day over coronavirus scare']","[1, 1, 1]",100.0,0.0,0.0,0.0,0.0,3,0,0,0,0
2020-02-29 00:00:00,2020-02-29 00:00:00-2020-02-29 00:00:00,['Coronavirus proves a body blow for inbound tourism in Tamil Nadu'],[2],0.0,0.0,0.0,100.0,0.0,0,0,0,1,0
2020-03-04 00:00:00,2020-03-04 00:00:00-2020-03-08 00:00:00,"['Covid: Frantic citizens call corpn; seek advice', 'Coronavirus in Tamil Nadu: Four suspected cases reported', 'Advisory issued on Covid 19', 'Fighting Covid-19: Is Tamil Nadu prepared?', 'Covid-19 threat: Domestic; international check-ins drop', 'coronavirus tamil nadu man who came from oman is states first corona positive case']","[1, 1, 2, 2, 1, 2]",50.0,0.0,0.0,50.0,0.0,3,0,0,3,0
2020-03-09 00:00:00,2020-03-09 00:00:00-2020-03-15 00:00:00,"['Southern railway wakes up to coronavirus threat', 'Chennai: Business events take a back seat as Covid-19 fears intensify', 'Covid-19 outbreak: Passenger screening porous at Chennai airport', 'Covid-19 scare in Chennai: Thermal sensors; namaste greet employees at offices', ""Coronavirus scare: It's better to be scared than sorry"", ""Coronavirus scare in Chennai: Faithful will greet with 'namaste'; won't kiss Cross on Good Friday"", 'Covid-19 scare in Chennai: Korean tenants face ire of landlords; told to vacate houses', ""PIL against 'repulsive' corona caller tune"", 'Coronavirus: Tamil Nadu students take Italian university classes online', ""Coronavirus scare: Don't panic; but take precautions; says Chennai Corporation"", 'Covid-19 scare in Chennai: Footfalls down at city gyms; swimming pools', 'Coronavirus outbreak: Italy-returned man triggers alarm in Chennai', 'Coronavirus scare: Tamil Nadu CM Edappadi K Palaniswami chairs meet; but what was on the table?', 'Greater Chennai Corporation sprays disinfectant in bid to battle coronavirus', 'Amidst coronavirus outbreak; they chose to ride out the crisis in Italy than head home', ""IIT-Madras scholar's coronavirus prank sends passengers and officials into a tizzy"", 'Other metros proactive; Chennai streets show no signs of Covid-19 panic', 'patronage of trains dips as neighbouring states clamp restrictions to prevent spread of covid 19']","[1, 1, 1, 1, 1, 3, 0, 0, 2, 1, 1, 1, 1, 1, 1, 0, 0, 0]",61.111111111111114,27.77777777777778,0.0,5.555555555555555,0.0,11,5,0,1,0
2020-03-16 00:00:00,2020-03-16 00:00:00-2020-03-22 00:00:00,"['Coronavirus in Chennai: OMR techies prepare to work from home', 'Coronavirus in Tamil Nadu: Engineering colleges tell students to go home', 'Coronavirus outbreak: Holiday for Classes till V; no theatre in 16 Tamil Nadu districts', 'Covid-19 scare: Tamil Nadu boards prevention train; government orders shutdown', '100-plus flights cancelled; airfares for April nosedive amid coronavirus scare in Chennai', 'Coronavirus scare in Chennai: Universities suspend classes; reschedule exams', 'Salons in the state mask up to combat deadly #COVID19', 'Chennai engineering college hostels may turn quarantine centres for coronavirus suspects', 'Covid-19 scare: Bars; restaurants to remain closed until March 31', ""Uttar Pradesh man who came by train is state's second coronavirus case"", ""Covid-19 outbreak in Chennai: 'Going door-to-door to make sure all is well'"", 'Coronavirus in Tamil Nadu: Temples cancel festivals; churches call off mass till March 31', 'Covid-19 in Chennai: Air crew worried over lack of screening', 'Chennai: Those near Covid-19 patient being tracked through phone numbers', 'Jipmer to treat its students with Covid-19 symptoms', 'Coronavirus in Tamil Nadu: How the vulnerable are under watch', 'Covid-19 scare in Tamil Nadu: Social welfare department to send aid to the elderly', 'Shelter homes turn away the homeless in Chennai citing coronavirus contraction fears', ""Covid-19 in Tamil Nadu: It's their call to quell panic from going viral"", 'Coronavirus scare in Chennai: Flyers to be sent home in minibuses', 'Covid-19: Soon; private labs to be allowed to test samples', 'Three new cases in Tamil Nadu; total Covid-19 patients rise to six']","[0, 0, 0, 0, 1, 1, 0, 1, 0, 1, 2, 0, 1, 1, 1, 1, 4, 1, 1, 1, 2, 1]",54.54545454545454,31.818181818181817,4.545454545454546,9.090909090909092,0.0,12,7,1,2,0
2020-03-23 00:00:00,2020-03-23 00:00:00-2020-03-29 00:00:00,"['Chennai slips into quarantine mode', 'Corona crooners in Chennai keep the cheer up on social media', '#CoronaLockdown: Home workouts and visits to farm keep Vijay Shankar occupied', 'Covid-19 cases rise to 12 in Tamil Nadu; first community transmission suspected', 'Coronavirus lockdown to delay Chennai metro project', 'Coronavirus scare: Chennai hospital to deploy robots to deliver food; medicines in wards', 'Coronavirus scare in Tamil Nadu: Crowd before the curfew', 'Covid-19 forces families indoors; brings board games back on the table', ""Covid-19 lockdown: No train home; migrant workers crammed in Chennai's halls"", '#CoronaImpact: A summer sans camps in Chennai', 'Treat your pets like family during lockdown; say experts', 'Air force; army on standby to help Tamil Nadu government battle coronavirus', 'No N95 masks for medicos in non-coronavirus blocks in Chennai', 'Eight more test positive for Covid-19 in Tamil Nadu; total cases up to 26', ""Here is how Chennai's college students are dealing with lockdown"", ""Stalin endorses PM's message on lockdown word for word; urges people to follow it"", 'Covid-19 stalls Rs 17;000 crore road projects in Tamil Nadu', 'Covid-19: 9 new cases in Tamil Nadu; 3 have no travel history; 500 doctors appointed', 'The art and science of kolam keep youngsters busy in the lockdown period', 'Government plans containment zones as Tamil Nadu in 2nd stage of Covid-19 transmission', 'Chennai: Want me to come with you; cop with coronavirus mask asks motorists']","[1, 2, 0, 1, 1, 1, 1, 0, 0, 2, 0, 1, 1, 1, 0, 0, 2, 2, 0, 1, 1]",47.61904761904761,33.33333333333333,0.0,19.047619047619047,0.0,10,7,0,4,0
2020-03-31 00:00:00,2020-03-31 00:00:00-2020-04-05 00:00:00,"['Tamil Nadu yet to mobilise 1 lakh idle doctors to take on Covid-19 crisis', 'Covid-19: Longer lockdown can contain virus; research finds', 'Store at Chennai mall in Covid eye', ""Tamil Nadu: House surgeons want 'special mention' about handling Covid-19 cases"", 'Tamil Nadu: Ex-rally champion goes the extra mile to fight Covid-19', 'Down and out in the time of lockdown', 'Coronavirus: 100 more positive cases take Tablighi Jamaat cluster count in Tamil Nadu to 364', 'Asymptomatic Tablighi Jamaat cluster spurs research on coronavirus strain in Tamil Nadu', 'Two die in 1 day in Tamil Nadu; coronavirus has no religion or caste; says CM EPS', 'Chennai: Out on Covid-19 bail; bike thief tries to steal another; held', ""Tamil Nadu's Covid-19 death toll rises to four"", 'coronavirus in chennai latest news updates on chennai corona cases deaths 05 april 2020', ""Tamil Nadu:'We are ready for rapid Covid-19 tests; numbers will soon be down'"", '112 private hospitals across Tamil Nadu to treat Covid-19 patients', '60-year-old Covid-19 positive patient dies in Chennai; Tamil Nadu toll rises to five']","[4, 2, 2, 2, 0, 1, 2, 1, 1, 1, 1, 1, 2, 1, 1]",53.333333333333336,6.666666666666667,6.666666666666667,33.33333333333333,0.0,8,1,1,5,0
2020-04-06 00:00:00,2020-04-06 00:00:00-2020-04-12 00:00:00,"['Coronavirus: Tamil Nadu toll hits 5; positive count 571 with 76 new cases', 'Tamil Nadu government allocates Rs 22.57 crore to set up quarantine centres', 'coronavirus in chennai latest news updates on chennai corona cases deaths 6 april 2020', 'Chennai: 3 Bangladeshi preachers defy lockdown rules; arrested', 'Chennai: Airport retail; duty-free shops to remain shut after lockdown', 'People should be wary even after lockdown: Expert', 'Chennai: Army; air force personnel defend the poor & needy from Covid double blow', 'SHRC seeks report on police excess during lockdown', ""Chennai students school people on Covid-19 don'ts"", 'Chennai: Beware! Covid-19 churn throws up phishing racket', 'Four Chennai doctors now have Covid-19; hospital cordoned off']","[2, 2, 1, 0, 0, 1, 4, 0, 0, 0, 1]",27.27272727272727,45.45454545454545,9.090909090909092,18.181818181818183,0.0,3,5,1,2,0
2020-04-13 00:00:00,2020-04-13 00:00:00-2020-04-19 00:00:00,"['This Chennai photog is capturing #CoronaCrisis stories with toys', 'Coronavirus positive cases cross 1;000; Tamil Nadu to test all with flu-like symptom', 'Tamil Nadu hopes extended lockdown will have some relaxations', 'Runners pace themselves for some lockdown workout', ""Want to locate a containment zone? Tap Greater Chennai Corporation's corona app"", 'Chennai lockdown: Now; connect to god at a click as pujas go online', 'Oppn demands Rs 1cr relief to kin of Covid-19 dead', 'Chinese denied roof spends 10 days in Tamil Nadu cave; tests Covid-19 negative', 'CM relief fund gets Rs 135 crore for Covid fight', 'Chennai: A sanitizer to kill genetic material of coronavirus', '25 new Covid-19 positives in Tamil Nadu; CM Edappadi K Palaniswami says fresh infections may end in three days', 'Tamil Nadu suggests Ayush remedies; yoga to take on coronavirus', ""TN's rural economy could hold answer to post-Covid blues"", ""TN's flower growers wilt under lockdown impact"", 'Coronavirus in Tamil Nadu: Cured? Please stay at home', ""Panic in Madras high court as coronavirus 'positive' staffer mingled in court"", ""Chennai: Parents start Facebook page to auction kid's lockdown art"", ""Two Madras HC lawyers donate Re 1 for lockdown relief; bar council to give them 'certificate of appreciation'""]","[2, 1, 2, 1, 2, 0, 4, 0, 2, 1, 2, 1, 0, 0, 2, 1, 2, 2]",27.77777777777778,22.22222222222222,5.555555555555555,44.44444444444444,0.0,5,4,1,8,0
2020-04-20 00:00:00,2020-04-20 00:00:00-2020-04-26 00:00:00,"[""King Institute takes the lead in TN's fight against Covid-19"", 'Local bodies a wasted force in grassroots fight against Covid-19', 'Tamil Nadu: 4.85 lakh of fishing community get Rs 1;000 Covid-19 aid', 'Ill-fitting goggles may be letting coronavirus in: Doctors', 'No relaxation; lockdown to continue till May 3: Tamil Nadu government', 'Tamil Nadu coronavirus toll now 17; 43 new cases', 'Tamil Nadu: Journalists; police brace for personal battle with Covid-19', 'Why Chennai remains a Covid-19 hotspot', 'Many ignore Covid-19 curbs; Chennai cops clueless', 'New Tamil Nadu cluster: 26 TV channel staff test Covid-19 +ve', 'Tamil Nadu: 80-plus & leading from the front in Covid-19 fight', '#BehindTheLockdown: Chennai Corp is fighting COVID-19; one tweet at a time', 'Tamil Nadu: Rs 50 lakh; job for kin if frontline staff die of Covid', ""PIL for disclosure of Covid patients' identity in Madras HC dismissed"", 'Rashes on feet could be sign of Covid-19', 'Time to look beyond lockdown; resume business: Industry to Tamil Nadu government', 'Ingredients in kabasura kudineer can fight Covid-19; say researchers in Chennai', 'Two deaths take Tamil Nadu toll to 20; Covid-19 positive count hits 1;683', 'Chennai: Pallavaram municipality careless about disposal of waste from Covid-19 patients', 'E-Akshaya Tritiya as jewellers sell gold online amid lockdown', 'High Covid-19 positive cases brings central team to Chennai', 'Who ordered the four-day complete lockdown and why?', 'Tamil Nadu: Citizens push norms aside; rub shoulders to shop for lockdown', 'Fewer Covid-19 cases in hotter regions']","[0, 0, 2, 1, 0, 2, 0, 2, 2, 2, 0, 0, 4, 0, 1, 2, 0, 2, 0, 2, 2, 0, 0, 0]",8.333333333333332,50.0,4.166666666666666,37.5,0.0,2,12,1,9,0
2020-04-27 00:00:00,2020-04-27 00:00:00-2020-05-03 00:00:00,"['Tamil Nadu: No new Covid-19 case in 13 districts; but fingers crossed', 'Central team takes stock of Covid-19 readiness in Chennai', 'Ramzan diets for diabetics; those in Covid-19 isolation', 'TN govt not in a hurry to lift lockdown fully', 'What the Covid map tells about Tamil Nadu', 'Tamil Nadu for staggered lockdown exit after May 3', ""Remote pacemakers ensure doctors don't skip a beat during lockdown"", 'Veggie markets a problem; people not serious about Covid-19: EPS', '90 fishermen embark on 1;000km voyage to escape lockdown in Tamil Nadu', 'Covid impact: Fumigation; disinfection costs double', 'Disregard for lockdown norms triggers clusters in Chennai', 'As Tamil Nadu awaits lockdown exit; cases hit 161 in one day; 138 in Chennai', 'Coronavirus spreading fast in Chennai; case count crosses 1;000-mark', 'PG medical students yet to get Covid-19 test results; live in fear', 'Coronavirus in Chennai: Police clip wings of lockdown violators with drones', 'Indoor pollution from firewood poses higher Covid risk: Researchers', 'coronavirus in chennai latest news updates on chennai corona cases deaths 02 may 2020', 'Chennai: Covid-19 warriors to get tributes from sky and sea', 'Living with fear: Nurse on Covid-19 duty narrates his experience', 'One fireman; five more cops test coronavirus positive in Tamil Nadu']","[0, 2, 1, 1, 4, 0, 1, 2, 1, 2, 1, 0, 1, 1, 1, 1, 1, 0, 1, 1]",60.0,20.0,5.0,15.0,0.0,12,4,1,3,0
2020-05-05 00:00:00,2020-05-05 00:00:00-2020-05-10 00:00:00,"['Govt to reverse order mandating temples to donate for Covid relief', 'Chennai: Anna Nagar cops calm Ooty man panicking over Covid-19 +ve test', 'Tamil Nadu: Covid-19 disrupts weather forecasts too', 'Lifting the lockdown: What it means for Tamil Nadu', 'Phased lockdown exit will delay peak in Tamil Nadu by 4 months; cut cases', 'As Covid-19 cases surge past 5;000 in TN; experts warn of Tasmac cluster', 'Chennai: Storks visit lockdown couples waiting for IVF babies', ""Why Covid testsaren't conclusive"", 'Rising Covid-19 numbers show good testing; tracing of contacts', 'Mad rush at Tasmac shops; shut them till lockdown is lifted: Madras HC', 'Virus cases cross 6;000-mark in Tamil Nadu; 1;589 linked to Koyambedu', 'Chennai: Covid mimics Kawasaki in some kids; say doctors', 'Tamil Nadu: The unpopular saviour - plastics play undisputed role in Covid-19 fight', 'Four women die; Tamil Nadu coronavirus count hits 6;535']","[2, 1, 1, 0, 0, 1, 1, 2, 2, 0, 1, 0, 0, 1]",42.857142857142854,35.714285714285715,0.0,21.428571428571427,0.0,6,5,0,3,0
2020-05-11 00:00:00,2020-05-11 00:00:00-2020-05-17 00:00:00,"[""Government doesn't believe Covid-19 killed all victims"", 'Two coronavirus positive women deliver while in isolation', 'Transport corporations lose Rs 1;200cr during lockdown', 'Covid-19 cases surge past 8;000 in Tamil Nadu; six deaths recorded in a day', 'Govt mulls new strategy as eight die across Tamil Nadu; Chennai records 510 Covid-19 cases', 'Who will quarantine returnees from Delhi? Railway; Tamil Nadu lock horns', 'ACP; police commando; fireman test Covid-19 + ve in Chennai', 'Tamil Nadu may extend lockdown till May 31 with more easing', 'With two deaths; 447 new Covid-19 cases; Tamil Nadu moves to second spot on national list', 'Tamil Nadu: Undercounting Covid-19 deaths can harm public health; hamper policy', 'Pets of Covid-19 patients turn homeless in Tamil Nadu', 'Tamil Nadu: Pulicat fisherfolk keep out Covid-19; fight to survive', 'Chennai: Over 1;000 Covid-19 cases in Royapuram; containment hard']","[0, 1, 0, 1, 0, 1, 1, 0, 2, 0, 4, 0, 0]",30.76923076923077,53.84615384615385,7.6923076923076925,7.6923076923076925,0.0,4,7,1,1,0
2020-05-18 00:00:00,2020-05-18 00:00:00-2020-05-24 00:00:00,"['Covid-19 was not their only enemy; they fought hatred', 'Chennai: Sholinganallur sees 13-fold rise in Covid-19 cases', 'Covid-19: Cases top 11;000; Tamil Nadu may tweak testing policy; 4 deaths take toll to 78', 'Maharashtra returnees among 536 fresh coronavirus cases in Tamil Nadu', 'Tamil Nadu: This test could chart the course of our battle against Covid-19', 'How the lockdown has marked the return of our motta maadis', 'Chennai: Of 200 wards; 31 record no Covid-19 case in last 3 days', 'Tamil Nadu coronavirus count touches 13;191; new testing plan for Chennai', 'Recovery rate in Tamil Nadu at 44 per cent amid Covid-19 carnage', ""Railways won't run trains from Chennai as Covid-19 cases surge"", 'Covid-19-hit Tamil Nadu bans creation of new govt posts in bid to save Rs 700 crore', 'Meet the creator of mural at Tambaram station that salutes COVID-19 warriors', ""Chennai's poor hit hardest by Covid; show micro clusters"", 'Tamil Nadu: Four guest workers from Aavin test positive for Covid-19', 'Two months into lockdown; Tamil Nadu cases zoom past 15;000; toll 103']","[0, 2, 0, 1, 0, 0, 0, 1, 4, 1, 0, 0, 4, 1, 0]",26.666666666666668,53.333333333333336,13.333333333333334,6.666666666666667,0.0,4,8,2,1,0
2020-05-25 00:00:00,2020-05-25 00:00:00-2020-05-31 00:00:00,"['Chennai: E-pass; home quarantine must for inbound flyers', 'Covid-19: Tamil Nadu count crosses 16;000; Chennai tally 10;000', 'No Class XII evaluation work in Chennai due to rising Covid-19 cases', 'Discipline; strong will help get over Covid; says recovered DCP', 'ICMR sits on proposal to try Rs 5 arthritis drug for Covid-19', 'Maharashtra returnees blamed as Tamil Nadu Covid tally crosses 17;000', 'Corona-hit cops get cured amid nature in Tamil Nadu', 'coronavirus in chennai latest news updates on chennai corona cases deaths 27 may 2020', 'lockdownwarriors meet the lockdown warriors who are aiding chennai and its police in this coronacrisis', ""Tamil Nadu: Pages from the diary of a 'Coronakaaran'"", 'Chennai civic body not testing neighbours of Covid-19 patients; say residents', 'Covid-19: Working to keep fatalities in Tamil Nadu down; says govt as 12 die in a day', 'Chennai: GH matron dies; dean denies coronavirus infection', 'What lockdown? Autos operate freely in Chennai', 'Tamil Nadu: After braving Covid-19; 260 cops return to work', 'Chennai: Disabled son left to fend for self as both parents test positive for coronavirus', 'Covid-19: In biggest 1-day surge; Tamil Nadu adds 874 cases; tally crosses 20;000', 'Chennai a challenge; Covid under control in Tamil Nadu: EPS', 'Covid-19: Five ways ahead as Tamil Nadu crosses 20;000 positive cases', 'Covid-19: Tamil Nadu plans to cap treatment cost as death toll reaches 160', 'TNSCB tenement in Pulianthope now 1;400-bed Covid care facility']","[1, 2, 2, 2, 2, 0, 2, 1, 1, 0, 0, 0, 0, 0, 0, 4, 2, 0, 2, 4, 2]",14.285714285714285,38.095238095238095,9.523809523809524,38.095238095238095,0.0,3,8,2,8,0
2020-06-01 00:00:00,2020-06-01 00:00:00-2020-06-07 00:00:00,"['Covid-19: Chennai corporation to test slum dwellers extensively', 'Covid-19: Tamil Nadu 1-day count tops 1;000; seniors badly affected', 'Partial lifting of lockdown cuts Tamil Nadu unemployment rate to 33% in May', ""Amid Tamil Nadu plan to hike doctors' pay; Covid-19 tally zooms past 23;000; death toll 184"", 'No info on Covid link to SARI cases', 'In shadow of Covid; puppeteer narratesmessage of safety', 'Temples across Tamil Nadu lose Rs 75 crore due to lockdown', 'As toll coronavirus case count keep rising; Tamil Nadu targets high-risk population', 'Tamil Nadu government to cap treatment cost for Covid-19 in private hospitals', 'Coronavirus cases cross 25;000; Tamil Nadu batting on a sticky wicket', ""For Tamil Nadu's 90-year olds; Covid is just another battle they have won"", 'Covid-19: Home quarantine violators warned of action in Chennai', ""Some private labs giving Covid-19 negative certificate; it's illegal: Chennai corporation chief"", 'Tamil Nadu: A few districts bear brunt of more returnees testing coronavirus positive', 'Mourning in the time of Covid-19', 'Chennai: Covid-19 occupancy in private hospitals triples despite steep bills', 'Chennai: Eight out of 39 Covid-19 convicts turn negative', 'Tamil Nadu insurance to cover coronavirus care in private hospitals', ""Will city's nightlife be an exciting one post lockdown?"", 'Covid-19: How Tamil Nadu attained high recovery rate', 'They battled Covid in ICUs and are now back to normal lives', 'Four Madras high court judges test Covid +ve; curbs back in courts', 'More chronic disease patients test positive for Covid-19; deaths go up in Tamil Nadu', 'Matrimony sites cash in as parents in lockdown pursue match for children', ""Children's home new Covid hotspot in Chennai"", 'Rush for hospital beds as Tamil Nadu Covid-19 tally hits 30;000', 'Soon; an app to alert availability of Covid-19 beds across hospitals in Chennai', 'Tamil Nadu caps Covid-19 treatment cost at private hospitals']","[0, 4, 4, 4, 0, 0, 0, 1, 1, 1, 2, 1, 0, 1, 4, 2, 0, 1, 2, 2, 2, 0, 1, 0, 1, 2, 2, 1]",32.142857142857146,28.57142857142857,14.285714285714285,25.0,0.0,9,8,4,7,0
2020-06-08 00:00:00,2020-06-08 00:00:00-2020-06-14 00:00:00,"['Quality control: Covid-19 test results of all labs in Tamil Nadu to be reviewed randomly', 'Covid-19: Unknown sources; high numbers in Tamil Nadu raise questions', 'Onus on community to stop Covid-19 spread in Tamil Nadu', 'For first time; Tamil Nadu records over 1;500 Covid-19 cases in a day', 'Chennai registers 75% fewer deaths during lockdown', ""Chennai-based runners' group organises virtual marathon to ease runners into post-Covid world"", ""Chennai: Corporation's Covid warriors lost in maze of forms and formalities"", 'Chennai K-pop fans dance away to a virtual face-off in the lockdown', ""Surge in Covid-19 cases to test Tamil Nadu's medical mettle"", 'Min: Virus spreading at lightning speed in TN', '236 Covid-19 deaths in Chennai not recorded by Tamil Nadu government', 'Work to restore Puzhuthivakkam lake; stalled by Covid; resumes', 'Why TN must come clean on Covid deaths', ""Chennai: Daughters design 'quarantine room' for dad who returned from Spain"", 'Anbazhagan passes away on his birthday; 1st MLA to die of coronavirus', ""Covid-19: Tamil Nadu's highest one-day tally of 1;927 takes count beyond 36;000"", 'State mines data to get its Covid death toll right', 'Tamil Nadu diverts Rs 376 crore savings of World Bank scheme to fight Covid-19', ""Can't Chennai alone be under lockdown; Madras HC asks Tamil Nadu"", 'Fighting Covid-19: What Chennai can learn from Bengaluru', 'Tamil Nadu government divided over intense lockdown in Chennai', 'Tamil Nadu: How a sugarcane farmer ensured a sweet time during lockdown', 'Rumours of new lockdown make bizmen anxious', '40 booked for violating home quarantine norms in Chennai', 'Covid-19: 1;982 fresh positive cases in Tamil Nadu; low-risk Chennai cases must wait for hospital beds', 'No lockdown for now: Tamil Nadu to Madras high court; EPS junks posts on social media', 'More strays being run over as lockdown eases in Chennai', 'Chennai corporation has no idea where 277 Covid-19 positive patients are', 'Covid deaths cross 9;000; 12;000+ cases on Saturday', 'lockdown impact covid 19 cases dip in chennai']","[2, 0, 0, 2, 0, 2, 4, 0, 2, 1, 1, 4, 2, 4, 4, 2, 4, 2, 0, 0, 0, 0, 1, 0, 1, 2, 0, 2, 2, 1]",16.666666666666664,33.33333333333333,16.666666666666664,33.33333333333333,0.0,5,10,5,10,0
